{
  "installation": "farm-bass443",
  "description": "Farm on the Cloudflare account bass443 (zone maxferit.cz). Addresses decided 2026-09-06 (assistant on the owner's 'up to you'): gateway apiHost behind Access, intake and notify addresses on the zone, recipients in policy/email.send are Email Routing aliases whose forwarding targets live only in the account. Plan: Workers Free until step 5 (queues) shows a need.",
  "tenants": ["tenant-42", "tenant-7"],
  "identities": [
    { "actorId": "svc-orchestrator", "actorType": "service", "tenantId": "tenant-42", "scopes": ["document.classify", "document.validate", "document.stamp", "document.archive", "mail.ingest", "email.send", "invoice.extract", "cz.company.verify"], "authStrength": "client-credentials" },
    { "actorId": "svc-orchestrator-t7", "actorType": "service", "tenantId": "tenant-7", "scopes": ["document.classify", "document.validate", "document.stamp", "document.archive", "mail.ingest", "email.send", "invoice.extract", "cz.company.verify"], "authStrength": "client-credentials" },
    { "actorId": "ai-doc-classifier", "actorType": "ai-agent", "tenantId": "tenant-42", "scopes": ["document.classify"], "authStrength": "client-credentials" },
    { "actorId": "access:bass443@gmail.com", "actorType": "human", "tenantId": "tenant-42", "scopes": ["document.reviewer", "document.supervisor"], "authStrength": "oidc-user" }
  ],
  "roles": { "orchestrator": "svc-orchestrator" },
  "credentials": {
    "document-stamp-handler": ["cred:dms-stamp"],
    "document-archive-handler": ["cred:archive-store"],
    "email-send-handler": ["cred:smtp"],
    "mail-ingest-handler": []
  },
  "channels": { "apiHost": "apf.maxferit.cz", "intakeAddress": "apf-intake@maxferit.cz", "notifyFrom": "apf-notify@maxferit.cz", "notifyFromName": "agent-platform-farm", "operatorAlertTo": "argos@maxferit.cz" },
  "retentionDays": { "originals": 30, "journal": 30, "audit": 90 },
  "policyRefs": ["document.classify", "document.validate", "document.stamp", "document.archive", "mail.ingest", "email.send", "invoice.extract", "cz.company.verify"],
  "models": {
    "invoice.extract": {
      "default": "llama-8b",
      "options": {
        "llama-8b": {
          "provider": "workers-ai",
          "model": "@cf/meta/llama-3.1-8b-instruct-fp8",
          "label": "Workers AI · Llama 3.1 8B fp8 (Free)",
          "processor": "Cloudflare Workers AI (Cloudflare, Inc.; DPA in the Cloudflare Customer Agreement; no training on inputs; region chosen by Cloudflare)"
        }
      }
    },
    "document.classify": {
      "default": "llama-8b",
      "options": {
        "llama-8b": {
          "provider": "workers-ai",
          "model": "@cf/meta/llama-3.1-8b-instruct-fp8",
          "label": "Workers AI · Llama 3.1 8B fp8 (Free)",
          "processor": "Cloudflare Workers AI (Cloudflare, Inc.; DPA in the Cloudflare Customer Agreement; no training on inputs; region chosen by Cloudflare)"
        },
        "llama-70b": {
          "provider": "workers-ai",
          "model": "@cf/meta/llama-3.3-70b-instruct-fp8-fast",
          "label": "Workers AI · Llama 3.3 70B (Free, neurons)",
          "processor": "Cloudflare Workers AI (as above)"
        },
        "claude-opus-5": {
          "provider": "anthropic",
          "model": "claude-opus-5",
          "label": "Anthropic · Claude Opus 5 (paid)",
          "credential": "cred:anthropic",
          "inferenceGeo": "eu",
          "processor": "Anthropic PBC via API (commercial terms + DPA; default retention 30 days, ZDR on request); inference pinned to EU"
        },
        "claude-haiku-4-5": {
          "provider": "anthropic",
          "model": "claude-haiku-4-5",
          "label": "Anthropic · Claude Haiku 4.5 (paid, cheap)",
          "credential": "cred:anthropic",
          "processor": "Anthropic PBC via API (commercial terms + DPA; default retention 30 days); inference geography not pinnable on this model"
        }
      }
    }
  }
}
